{
 "schema_version": "1.0",
 "package_id": "STORY_053",
 "package_version": "v1",
 "title": "Mặt nạ chì — lời nhắn còn dang dở",
 "language": "vi",
 "case": {
  "name": "Lead Masks Case",
  "place": "Niterói, Rio de Janeiro, Brazil",
  "year": 1966
 },
 "provenance": {
  "derived_from": "projects/lead-masks-1966-pilot (evidence-canon.json, research_brief.json, v2/master-narrative.json)",
  "canon_version": "v1",
  "created_on": "2026-10-22",
  "notes": "Claims, statuses, qualifiers, sources and narrative copied verbatim; entities, continuity rules and format selection are M2.1 editorial additions."
 },
 "sources": [
  {
   "id": "SRC_001",
   "title": "Boletim de ocorrência nº 535",
   "publisher": "Niterói 2nd Police District / reproduced by pmig96",
   "date": "1966-08-21",
   "url": "https://pmig96.wordpress.com/2026/08/16/the-initial-police-report/",
   "reference": "Boletim de ocorrência nº 535; 1966-08-21",
   "source_type": "primary_record_reproduction",
   "reliability": "primary",
   "notes": "Primary status describes original document/publication. Hosting/reproduction and translations are secondary; no official archive authentication claimed.",
   "verification": {
    "status": "verified",
    "checked_on": "2026-10-22",
    "method": "WebFetch",
    "note": "Fetched URL on 2026-10-22; page content matches the claim details (attributed reproduction/transcription; original archive not accessed)."
   }
  },
  {
   "id": "SRC_002",
   "title": "Laudo de exame em local de morte nº 29.375",
   "publisher": "Departamento de Polícia Técnica / reproduced by pmig96",
   "date": "1966-08-21",
   "url": "https://pmig96.wordpress.com/2026/08/21/cena-de-morte/",
   "reference": "Laudo de exame em local de morte nº 29.375; 1966-08-21",
   "source_type": "primary_record_reproduction",
   "reliability": "primary",
   "notes": "Primary status describes original document/publication. Hosting/reproduction and translations are secondary; no official archive authentication claimed.",
   "verification": {
    "status": "verified",
    "checked_on": "2026-10-22",
    "method": "WebFetch",
    "note": "Fetched URL on 2026-10-22; page content matches the claim details (attributed reproduction/transcription; original archive not accessed). Transcribes the first name as 'Manuel'; masks 'between the two bodies'."
   }
  },
  {
   "id": "SRC_003",
   "title": "Necrópsias 3051/66, 3052/66; exumação e toxicologia 4244/67",
   "publisher": "IML / reproduced and analyzed by pmig96",
   "date": "1966-08-21 / 1967-10-18",
   "url": "https://pmig96.wordpress.com/2026/08/30/forensics/",
   "reference": "Necrópsias 3051/66, 3052/66; exumação e toxicologia 4244/67; 1966-08-21 / 1967-10-18",
   "source_type": "primary_record_reproduction",
   "reliability": "primary",
   "notes": "Primary status describes original document/publication. Hosting/reproduction and translations are secondary; no official archive authentication claimed.",
   "verification": {
    "status": "verified",
    "checked_on": "2026-10-22",
    "method": "WebFetch",
    "note": "Fetched URL on 2026-10-22; page content matches the claim details (attributed reproduction/transcription; original archive not accessed)."
   }
  },
  {
   "id": "SRC_004",
   "title": "Masked dead men were radio and TV technicians",
   "publisher": "Diário de Notícias / clipping reproduced by pmig96",
   "date": "1966-08-24",
   "url": "https://pmig96.wordpress.com/lead-masks-case-sources-part-2/",
   "reference": "Masked dead men were radio and TV technicians; 1966-08-24",
   "source_type": "contemporary_press_reproduction",
   "reliability": "primary",
   "notes": "Primary status describes original document/publication. Hosting/reproduction and translations are secondary; no official archive authentication claimed.",
   "verification": {
    "status": "previously_inspected",
    "checked_on": "2026-10-13",
    "method": "pilot research",
    "note": "Retrieved during pilot research (research_brief retrieved_at); not rechecked in M2.1."
   }
  },
  {
   "id": "SRC_005",
   "title": "Deaths of electronics technicians still a mystery",
   "publisher": "Correio da Manhã / clipping reproduced by pmig96",
   "date": "1966-08-24",
   "url": "https://pmig96.wordpress.com/lead-masks-case-sources-part-1/",
   "reference": "Deaths of electronics technicians still a mystery; 1966-08-24",
   "source_type": "contemporary_press_reproduction",
   "reliability": "primary",
   "notes": "Primary status describes original document/publication. Hosting/reproduction and translations are secondary; no official archive authentication claimed.",
   "verification": {
    "status": "previously_inspected",
    "checked_on": "2026-10-13",
    "method": "pilot research",
    "note": "Retrieved during pilot research (research_brief retrieved_at); not rechecked in M2.1."
   }
  },
  {
   "id": "SRC_006",
   "title": "Mystery deepens; experiments and family testimony",
   "publisher": "Luta Democrática / clippings reproduced by pmig96",
   "date": "1966-08-27 / 1966-08-30",
   "url": "https://pmig96.wordpress.com/lead-masks-case-sources-part-3/",
   "reference": "Mystery deepens; experiments and family testimony; 1966-08-27 / 1966-08-30",
   "source_type": "contemporary_press_reproduction",
   "reliability": "primary",
   "notes": "Primary status describes original document/publication. Hosting/reproduction and translations are secondary; no official archive authentication claimed.",
   "verification": {
    "status": "previously_inspected",
    "checked_on": "2026-10-13",
    "method": "pilot research",
    "note": "Retrieved during pilot research (research_brief retrieved_at); not rechecked in M2.1."
   }
  },
  {
   "id": "SRC_007",
   "title": "Masks from Niterói crime did not contain radioactivity",
   "publisher": "Jornal do Brasil; José Machado / reproduced by pmig96",
   "date": "1966-08-24",
   "url": "https://pmig96.wordpress.com/lead-masks-case-sources-part-5/",
   "reference": "Masks from Niterói crime did not contain radioactivity; 1966-08-24",
   "source_type": "contemporary_press_reproduction",
   "reliability": "primary",
   "notes": "Primary status describes original document/publication. Hosting/reproduction and translations are secondary; no official archive authentication claimed.",
   "verification": {
    "status": "previously_inspected",
    "checked_on": "2026-10-13",
    "method": "pilot research",
    "note": "Retrieved during pilot research (research_brief retrieved_at); not rechecked in M2.1."
   }
  },
  {
   "id": "SRC_008",
   "title": "Scientific experiment killed electronics technicians",
   "publisher": "Jornal do Brasil; José Machado / reproduced by pmig96",
   "date": "1966-08-25",
   "url": "https://pmig96.wordpress.com/lead-masks-case-sources-part-5/",
   "reference": "Scientific experiment killed electronics technicians; 1966-08-25",
   "source_type": "contemporary_press_reproduction",
   "reliability": "primary",
   "notes": "Primary status describes original document/publication. Hosting/reproduction and translations are secondary; no official archive authentication claimed.",
   "verification": {
    "status": "previously_inspected",
    "checked_on": "2026-10-13",
    "method": "pilot research",
    "note": "Retrieved during pilot research (research_brief retrieved_at); not rechecked in M2.1."
   }
  },
  {
   "id": "SRC_009",
   "title": "Linha Direta: Máscaras de Chumbo",
   "publisher": "Rede Globo",
   "date": "2004-06-24",
   "url": "https://redeglobo.globo.com/Linhadireta/0,26665,4625-p-200406,00.html",
   "reference": "Linha Direta: Máscaras de Chumbo; 2004-06-24",
   "source_type": "later_reporting",
   "reliability": "secondary",
   "notes": "Fonte editorial independente do agregador. Diz que toxicologia nunca foi feita; contradiz laudos reproduzidos. Data de descoberta e posição das máscaras também diferem.",
   "verification": {
    "status": "unreachable",
    "checked_on": "2026-10-22",
    "method": "WebFetch",
    "note": "Fetch tool could not access redeglobo.globo.com; retrieved during pilot research on 2026-10-13."
   }
  },
  {
   "id": "SRC_010",
   "title": "The Lead Masks Case — sourced chronology",
   "publisher": "pmig96",
   "date": "2021-05-10; updated 2026-09-12",
   "url": "https://pmig96.wordpress.com/2021/05/10/the-lead-masks-case/",
   "reference": "The Lead Masks Case — sourced chronology; 2021-05-10; updated 2026-09-12",
   "source_type": "later_research",
   "reliability": "secondary",
   "notes": "Discovery/corroboration only, with links to named original publications. Not an independent primary authority.",
   "verification": {
    "status": "verified",
    "checked_on": "2026-10-22",
    "method": "WebFetch",
    "note": "Fetched URL on 2026-10-22; page content matches the claim details (attributed reproduction/transcription; original archive not accessed). Later research/aggregator, not a primary authority."
   }
  },
  {
   "id": "SRC_011",
   "title": "Not all is Lost — surviving document provenance",
   "publisher": "pmig96",
   "date": "2026-08-06",
   "url": "https://pmig96.wordpress.com/2026/08/06/not-all-is-lost/",
   "reference": "Not all is Lost — surviving document provenance; 2026-08-06",
   "source_type": "later_research",
   "reliability": "secondary",
   "notes": "Reports chain via Mário Dias / Carlos Alberto Machado and lists surviving copies; chain is attributed, not independently authenticated.",
   "verification": {
    "status": "previously_inspected",
    "checked_on": "2026-10-13",
    "method": "pilot research",
    "note": "Retrieved during pilot research (research_brief retrieved_at); not rechecked in M2.1."
   }
  },
  {
   "id": "SRC_012",
   "title": "Death masks archived still in mystery",
   "publisher": "Correio da Manhã / clipping reproduced by pmig96",
   "date": "1967-11-29",
   "url": "https://pmig96.wordpress.com/lead-masks-case-sources-part-1/",